
    =========================== USB Port2 ===========================

Connection Status        : 0x01 (Device is connected)
Port Chain               : 1-2-2-2
Properties               : 0x01
 IsUserConnectable       : yes
 PortIsDebugCapable      : no
 PortHasMultiCompanions  : no
 PortConnectorIsTypeC    : no
ConnectionIndex          : 0x02 (Port 2)
CompanionIndex           : 0
 CompanionHubSymLnk      : USB#VID_2109&PID_0813#6&c8f3955&0&2#{f18a0e88-c30c-11d0-8815-00a0c906bed8}
 CompanionPortNumber     : 0x02 (Port 2)
 -> CompanionPortChain   : 1-24-2-2

      ========================== Summary =========================
Vendor ID                : 0x0483 (STMicroelectronics)
Product ID               : 0x5711
USB Version              : 2.0 -> but Device is Full-Speed only
Port maximum Speed       : High-Speed (Companion Port 1-24-2-2 supports SuperSpeed)
Device maximum Speed     : Full-Speed
Device Connection Speed  : Full-Speed
Self powered             : no
Demanded Current         : 500 mA
Used Endpoints           : 5

      ======================== USB Device ========================

        +++++++++++++++++ Device Information ++++++++++++++++++
Device Description       : USB Composite Device
Device Path              : \\?\USB#VID_0483&PID_5711#5D94176E3039#{a5dcbf10-6530-11d2-901f-00c04fb951ed} (GUID_DEVINTERFACE_USB_DEVICE)
Kernel Name              : \Device\USBPDO-33
Device ID                : USB\VID_0483&PID_5711\5D94176E3039
Hardware IDs             : USB\VID_0483&PID_5711&REV_0000 USB\VID_0483&PID_5711
Driver KeyName           : {36fc9e60-c465-11cf-8056-444553540000}\0025 (GUID_DEVCLASS_USB)
Driver                   : \SystemRoot\System32\drivers\usbccgp.sys (Version: 10.0.26100.5074  Date: 2025-09-09)
Driver Inf               : C:\WINDOWS\inf\usb.inf
Legacy BusType           : PNPBus
Class                    : USB
Class GUID               : {36fc9e60-c465-11cf-8056-444553540000} (GUID_DEVCLASS_USB)
Service                  : usbccgp
Enumerator               : USB
Location Info            : Port_#0002.Hub_#0014
Location IDs             : PCIROOT(0)#PCI(1400)#USBROOT(0)#USB(2)#USB(2)#USB(2), ACPI(_SB_)#ACPI(PC00)#ACPI(XHCI)#ACPI(RHUB)#ACPI(HS02)#ACPI(HSS2)#USB(2)
Container ID             : {adb03edd-5b6e-555f-a032-79939afb1609}
Manufacturer Info        : (Standard USB Host Controller)
Capabilities             : 0x94 (Removable, UniqueID, SurpriseRemovalOK)
Status                   : 0x0180600A (DN_DRIVER_LOADED, DN_STARTED, DN_DISABLEABLE, DN_REMOVABLE, DN_NT_ENUMERATOR, DN_NT_DRIVER)
Problem Code             : 0
Address                  : 2
Power State              : D0 (supported: D0, D2, D3, wake from D0, wake from D2)
 Child Device 1          : USB Serial Device (COM7)
  Device Path            : \\?\USB#VID_0483&PID_5711&MI_00#8&1324c480&0&0000#{86e0d1e0-8089-11d0-9ce4-08003e301f73} (GUID_DEVINTERFACE_COMPORT)
  Kernel Name            : \Device\0000012d
  Device ID              : USB\VID_0483&PID_5711&MI_00\8&1324C480&0&0000
  Class                  : Ports
  Driver KeyName         : {4d36e978-e325-11ce-bfc1-08002be10318}\0003 (GUID_DEVCLASS_PORTS)
  Service                : usbser
  Location               : 0000.0014.0000.002.002.002.000.000.000
  LocationPaths          : PCIROOT(0)#PCI(1400)#USBROOT(0)#USB(2)#USB(2)#USB(2)#USBMI(0)  PCIROOT(0)#PCI(1400)#USBROOT(0)#USB(2)#USB(2)#USB(2)#USB(2)  ACPI(_SB_)#ACPI(PC00)#ACPI(XHCI)#ACPI(RHUB)#ACPI(HS02)#ACPI(HSS2)#USB(2)#USBMI(0)  ACPI(_SB_)#ACPI(PC00)#ACPI(XHCI)#ACPI(RHUB)#ACPI(HS02)#ACPI(HSS2)#USB(2)#USB(2)
  COM-Port               : COM7 (\Device\USBSER000)
 Child Device 2          : USB Serial Device (COM9)
  Device Path            : \\?\USB#VID_0483&PID_5711&MI_02#8&1324c480&0&0002#{86e0d1e0-8089-11d0-9ce4-08003e301f73} (GUID_DEVINTERFACE_COMPORT)
  Kernel Name            : \Device\0000012e
  Device ID              : USB\VID_0483&PID_5711&MI_02\8&1324C480&0&0002
  Class                  : Ports
  Driver KeyName         : {4d36e978-e325-11ce-bfc1-08002be10318}\0004 (GUID_DEVCLASS_PORTS)
  Service                : usbser
  Location               : 0000.0014.0000.002.002.002.000.000.000
  LocationPaths          : PCIROOT(0)#PCI(1400)#USBROOT(0)#USB(2)#USB(2)#USB(2)#USBMI(2)  ACPI(_SB_)#ACPI(PC00)#ACPI(XHCI)#ACPI(RHUB)#ACPI(HS02)#ACPI(HSS2)#USB(2)#USBMI(2)
  COM-Port               : COM9 (\Device\USBSER001)

        +++++++++++++++++ Registry USB Flags +++++++++++++++++
HKEY_LOCAL_MACHINE\SYSTEM\CurrentControlSet\Control\usbflags\048357110000
 osvc                    : REG_BINARY 00 00
 NewInterfaceUsage       : REG_DWORD 00000000 (0)

        ---------------- Connection Information ---------------
Connection Index         : 0x02 (Port 2)
Connection Status        : 0x01 (DeviceConnected)
Current Config Value     : 0x01 (Configuration 1)
Device Address           : 0x33 (51)
Is Hub                   : 0x00 (no)
Device Bus Speed         : 0x01 (Full-Speed)
Number Of Open Pipes     : 0x04 (4 pipes to data endpoints)
Pipe[0]                  : EndpointID=2  Direction=OUT  ScheduleOffset=0  Type=Bulk  wMaxPacketSize=0x20    bInterval=0  
Pipe[1]                  : EndpointID=1  Direction=IN   ScheduleOffset=0  Type=Bulk  wMaxPacketSize=0x20    bInterval=0  
Pipe[2]                  : EndpointID=4  Direction=OUT  ScheduleOffset=0  Type=Bulk  wMaxPacketSize=0x20    bInterval=0  
Pipe[3]                  : EndpointID=3  Direction=IN   ScheduleOffset=0  Type=Bulk  wMaxPacketSize=0x20    bInterval=0  
Data (HexDump)           : 02 00 00 00 12 01 00 02 00 00 00 40 83 04 11 57   ...........@...W
                           00 00 01 02 03 01 01 01 00 33 00 04 00 00 00 01   .........3......
                           00 00 00 07 05 02 02 20 00 00 00 00 00 00 07 05   ....... ........
                           81 02 20 00 00 00 00 00 00 07 05 04 02 20 00 00   .. .......... ..
                           00 00 00 00 07 05 83 02 20 00 00 00 00 00 00      ........ ......

        --------------- Connection Information V2 -------------
Connection Index         : 0x02 (2)
Length                   : 0x10 (16 bytes)
SupportedUsbProtocols    : 0x03
 Usb110                  : 1 (yes, port supports USB 1.1)
 Usb200                  : 1 (yes, port supports USB 2.0)
 Usb300                  : 0 (no, port not supports USB 3.0) -> but Companion Port 1-24-2-2 does
 ReservedMBZ             : 0x00
Flags                    : 0x00
 DevIsOpAtSsOrHigher     : 0 (Device is not operating at SuperSpeed or higher)
 DevIsSsCapOrHigher      : 0 (Device is not SuperSpeed capable or higher)
 DevIsOpAtSsPlusOrHigher : 0 (Device is not operating at SuperSpeedPlus or higher)
 DevIsSsPlusCapOrHigher  : 0 (Device is not SuperSpeedPlus capable or higher)
 ReservedMBZ             : 0x00
Data (HexDump)           : 02 00 00 00 10 00 00 00 03 00 00 00 00 00 00 00   ................

    ---------------------- Device Descriptor ----------------------
bLength                  : 0x12 (18 bytes)
bDescriptorType          : 0x01 (Device Descriptor)
bcdUSB                   : 0x200 (USB Version 2.0) -> but device is Full-Speed only
bDeviceClass             : 0x00 (defined by the interface descriptors)
bDeviceSubClass          : 0x00
bDeviceProtocol          : 0x00
bMaxPacketSize0          : 0x40 (64 bytes)
idVendor                 : 0x0483 (STMicroelectronics)
idProduct                : 0x5711
bcdDevice                : 0x0000
iManufacturer            : 0x01 (String Descriptor 1)
 Language 0x0409         : "STMicroelectronics"
iProduct                 : 0x02 (String Descriptor 2)
 Language 0x0409         : "BLUEPILL_F103C8 HID in FS Mode"
iSerialNumber            : 0x03 (String Descriptor 3)
 Language 0x0409         : "5D94176E3039"
bNumConfigurations       : 0x01 (1 Configuration)
Data (HexDump)           : 12 01 00 02 00 00 00 40 83 04 11 57 00 00 01 02   .......@...W....
                           03 01                                             ..

    ------------------ Configuration Descriptor -------------------
bLength                  : 0x09 (9 bytes)
bDescriptorType          : 0x02 (Configuration Descriptor)
wTotalLength             : 0x007F (127 bytes)
bNumInterfaces           : 0x04 (4 Interfaces)
bConfigurationValue      : 0x01 (Configuration 1)
iConfiguration           : 0x00 (No String Descriptor)
bmAttributes             : 0x80
 D7: Reserved, set 1     : 0x01
 D6: Self Powered        : 0x00 (no)
 D5: Remote Wakeup       : 0x00 (no)
 D4..0: Reserved, set 0  : 0x00
MaxPower                 : 0xFA (500 mA)
Data (HexDump)           : 09 02 7F 00 04 01 00 80 FA 08 0B 00 02 02 02 00   ................
                           00 09 04 00 00 00 02 02 00 00 05 24 00 10 01 04   ...........$....
                           24 02 06 05 24 06 00 01 05 24 01 01 01 09 04 01   $...$....$......
                           00 02 0A 00 00 00 07 05 02 02 20 00 00 07 05 81   .......... .....
                           02 20 00 00 08 0B 02 02 02 02 00 00 09 04 02 00   . ..............
                           00 02 02 00 00 05 24 00 10 01 04 24 02 06 05 24   ......$....$...$
                           06 02 03 05 24 01 01 01 09 04 03 00 02 0A 00 00   ....$...........
                           00 07 05 04 02 20 00 00 07 05 83 02 20 00 00      ..... ...... ..

        ------------------- IAD Descriptor --------------------
bLength                  : 0x08 (8 bytes)
bDescriptorType          : 0x0B (Interface Association Descriptor)
bFirstInterface          : 0x00 (Interface 0)
bInterfaceCount          : 0x02 (2 Interfaces)
bFunctionClass           : 0x02 (Communications and CDC Control)
bFunctionSubClass        : 0x02
bFunctionProtocol        : 0x00
iFunction                : 0x00 (No String Descriptor)
Data (HexDump)           : 08 0B 00 02 02 02 00 00                           ........

        ---------------- Interface Descriptor -----------------
bLength                  : 0x09 (9 bytes)
bDescriptorType          : 0x04 (Interface Descriptor)
bInterfaceNumber         : 0x00 (Interface 0)
bAlternateSetting        : 0x00
bNumEndpoints            : 0x00 (Default Control Pipe only)
bInterfaceClass          : 0x02 (Communications and CDC Control)
bInterfaceSubClass       : 0x02 (Abstract Control Model)
bInterfaceProtocol       : 0x00 (No class specific protocol required)
iInterface               : 0x00 (No String Descriptor)
Data (HexDump)           : 09 04 00 00 00 02 02 00 00                        .........

        -------------- CDC Interface Descriptor ---------------
bFunctionLength          : 0x05 (5 bytes)
bDescriptorType          : 0x24 (Interface)
bDescriptorSubType       : 0x00 (Header Functional Descriptor)
bcdCDC                   : 0x110 (CDC Version 1.10)
Data (HexDump)           : 05 24 00 10 01                                    .$...

        -------------- CDC Interface Descriptor ---------------
bFunctionLength          : 0x04 (4 bytes)
bDescriptorType          : 0x24 (Interface)
bDescriptorSubType       : 0x02 (Abstract Control Management Functional Descriptor)
bmCapabilities           : 0x06
 D7..4                   : 0x00 (Reserved)
 D3                      : 0x00 (not supports the notification Network_Connection)
 D2                      : 0x01 (supports the request Send_Break)
 D1                      : 0x01 (supports the request combination of Set_Line_Coding, Set_Control_Line_State, Get_Line_Coding, and the notification Serial_State)
 D0                      : 0x00 (not supports the request combination of Set_Comm_Feature, Clear_Comm_Feature, and Get_Comm_Feature)
Data (HexDump)           : 04 24 02 06                                       .$..

        -------------- CDC Interface Descriptor ---------------
bFunctionLength          : 0x05 (5 bytes)
bDescriptorType          : 0x24 (Interface)
bDescriptorSubType       : 0x06 (Union Functional Descriptor)
bControlInterface        : 0x00
bSubordinateInterface[0] : 0x01
Data (HexDump)           : 05 24 06 00 01                                    .$...

        -------------- CDC Interface Descriptor ---------------
bFunctionLength          : 0x05 (5 bytes)
bDescriptorType          : 0x24 (Interface)
bDescriptorSubType       : 0x01 (Call Management Functional Descriptor)
bmCapabilities           : 0x01
 D7..2                   : 0x00 (Reserved)
 D1                      : 0x00 (sends/receives call management information only over the Communication Class interface)
 D0                      : 0x01 (handles call management itself)
bDataInterface           : 0x01
Data (HexDump)           : 05 24 01 01 01                                    .$...

        ---------------- Interface Descriptor -----------------
bLength                  : 0x09 (9 bytes)
bDescriptorType          : 0x04 (Interface Descriptor)
bInterfaceNumber         : 0x01 (Interface 1)
bAlternateSetting        : 0x00
bNumEndpoints            : 0x02 (2 Endpoints)
bInterfaceClass          : 0x0A (CDC-Data)
bInterfaceSubClass       : 0x00
bInterfaceProtocol       : 0x00
iInterface               : 0x00 (No String Descriptor)
Data (HexDump)           : 09 04 01 00 02 0A 00 00 00                        .........

        ----------------- Endpoint Descriptor -----------------
bLength                  : 0x07 (7 bytes)
bDescriptorType          : 0x05 (Endpoint Descriptor)
bEndpointAddress         : 0x02 (Direction=OUT EndpointID=2)
bmAttributes             : 0x02 (TransferType=Bulk)
wMaxPacketSize           : 0x0020 (32 bytes)
bInterval                : 0x00 (ignored)
Data (HexDump)           : 07 05 02 02 20 00 00                              .... ..

        ----------------- Endpoint Descriptor -----------------
bLength                  : 0x07 (7 bytes)
bDescriptorType          : 0x05 (Endpoint Descriptor)
bEndpointAddress         : 0x81 (Direction=IN EndpointID=1)
bmAttributes             : 0x02 (TransferType=Bulk)
wMaxPacketSize           : 0x0020 (32 bytes)
bInterval                : 0x00 (ignored)
Data (HexDump)           : 07 05 81 02 20 00 00                              .... ..

        ------------------- IAD Descriptor --------------------
bLength                  : 0x08 (8 bytes)
bDescriptorType          : 0x0B (Interface Association Descriptor)
bFirstInterface          : 0x02 (Interface 2)
bInterfaceCount          : 0x02 (2 Interfaces)
bFunctionClass           : 0x02 (Communications and CDC Control)
bFunctionSubClass        : 0x02
bFunctionProtocol        : 0x00
iFunction                : 0x00 (No String Descriptor)
Data (HexDump)           : 08 0B 02 02 02 02 00 00                           ........

        ---------------- Interface Descriptor -----------------
bLength                  : 0x09 (9 bytes)
bDescriptorType          : 0x04 (Interface Descriptor)
bInterfaceNumber         : 0x02 (Interface 2)
bAlternateSetting        : 0x00
bNumEndpoints            : 0x00 (Default Control Pipe only)
bInterfaceClass          : 0x02 (Communications and CDC Control)
bInterfaceSubClass       : 0x02 (Abstract Control Model)
bInterfaceProtocol       : 0x00 (No class specific protocol required)
iInterface               : 0x00 (No String Descriptor)
Data (HexDump)           : 09 04 02 00 00 02 02 00 00                        .........

        -------------- CDC Interface Descriptor ---------------
bFunctionLength          : 0x05 (5 bytes)
bDescriptorType          : 0x24 (Interface)
bDescriptorSubType       : 0x00 (Header Functional Descriptor)
bcdCDC                   : 0x110 (CDC Version 1.10)
Data (HexDump)           : 05 24 00 10 01                                    .$...

        -------------- CDC Interface Descriptor ---------------
bFunctionLength          : 0x04 (4 bytes)
bDescriptorType          : 0x24 (Interface)
bDescriptorSubType       : 0x02 (Abstract Control Management Functional Descriptor)
bmCapabilities           : 0x06
 D7..4                   : 0x00 (Reserved)
 D3                      : 0x00 (not supports the notification Network_Connection)
 D2                      : 0x01 (supports the request Send_Break)
 D1                      : 0x01 (supports the request combination of Set_Line_Coding, Set_Control_Line_State, Get_Line_Coding, and the notification Serial_State)
 D0                      : 0x00 (not supports the request combination of Set_Comm_Feature, Clear_Comm_Feature, and Get_Comm_Feature)
Data (HexDump)           : 04 24 02 06                                       .$..

        -------------- CDC Interface Descriptor ---------------
bFunctionLength          : 0x05 (5 bytes)
bDescriptorType          : 0x24 (Interface)
bDescriptorSubType       : 0x06 (Union Functional Descriptor)
bControlInterface        : 0x02
bSubordinateInterface[0] : 0x03
Data (HexDump)           : 05 24 06 02 03                                    .$...

        -------------- CDC Interface Descriptor ---------------
bFunctionLength          : 0x05 (5 bytes)
bDescriptorType          : 0x24 (Interface)
bDescriptorSubType       : 0x01 (Call Management Functional Descriptor)
bmCapabilities           : 0x01
 D7..2                   : 0x00 (Reserved)
 D1                      : 0x00 (sends/receives call management information only over the Communication Class interface)
 D0                      : 0x01 (handles call management itself)
bDataInterface           : 0x01
Data (HexDump)           : 05 24 01 01 01                                    .$...

        ---------------- Interface Descriptor -----------------
bLength                  : 0x09 (9 bytes)
bDescriptorType          : 0x04 (Interface Descriptor)
bInterfaceNumber         : 0x03 (Interface 3)
bAlternateSetting        : 0x00
bNumEndpoints            : 0x02 (2 Endpoints)
bInterfaceClass          : 0x0A (CDC-Data)
bInterfaceSubClass       : 0x00
bInterfaceProtocol       : 0x00
iInterface               : 0x00 (No String Descriptor)
Data (HexDump)           : 09 04 03 00 02 0A 00 00 00                        .........

        ----------------- Endpoint Descriptor -----------------
bLength                  : 0x07 (7 bytes)
bDescriptorType          : 0x05 (Endpoint Descriptor)
bEndpointAddress         : 0x04 (Direction=OUT EndpointID=4)
bmAttributes             : 0x02 (TransferType=Bulk)
wMaxPacketSize           : 0x0020 (32 bytes)
bInterval                : 0x00 (ignored)
Data (HexDump)           : 07 05 04 02 20 00 00                              .... ..

        ----------------- Endpoint Descriptor -----------------
bLength                  : 0x07 (7 bytes)
bDescriptorType          : 0x05 (Endpoint Descriptor)
bEndpointAddress         : 0x83 (Direction=IN EndpointID=3)
bmAttributes             : 0x02 (TransferType=Bulk)
wMaxPacketSize           : 0x0020 (32 bytes)
bInterval                : 0x00 (ignored)
Data (HexDump)           : 07 05 83 02 20 00 00                              .... ..

    ----------------- Device Qualifier Descriptor -----------------
Error                    : ERROR_GEN_FAILURE  (because the device is Full-Speed only)

      -------------------- String Descriptors -------------------
             ------ String Descriptor 0 ------
bLength                  : 0x04 (4 bytes)
bDescriptorType          : 0x03 (String Descriptor)
Language ID[0]           : 0x0409 (English - United States)
Data (HexDump)           : 04 03 09 04                                       ....
             ------ String Descriptor 1 ------
bLength                  : 0x26 (38 bytes)
bDescriptorType          : 0x03 (String Descriptor)
Language 0x0409          : "STMicroelectronics"
Data (HexDump)           : 26 03 53 00 54 00 4D 00 69 00 63 00 72 00 6F 00   &.S.T.M.i.c.r.o.
                           65 00 6C 00 65 00 63 00 74 00 72 00 6F 00 6E 00   e.l.e.c.t.r.o.n.
                           69 00 63 00 73 00                                 i.c.s.
             ------ String Descriptor 2 ------
bLength                  : 0x3E (62 bytes)
bDescriptorType          : 0x03 (String Descriptor)
Language 0x0409          : "BLUEPILL_F103C8 HID in FS Mode"
Data (HexDump)           : 3E 03 42 00 4C 00 55 00 45 00 50 00 49 00 4C 00   >.B.L.U.E.P.I.L.
                           4C 00 5F 00 46 00 31 00 30 00 33 00 43 00 38 00   L._.F.1.0.3.C.8.
                           20 00 48 00 49 00 44 00 20 00 69 00 6E 00 20 00    .H.I.D. .i.n. .
                           46 00 53 00 20 00 4D 00 6F 00 64 00 65 00         F.S. .M.o.d.e.
             ------ String Descriptor 3 ------
bLength                  : 0x1A (26 bytes)
bDescriptorType          : 0x03 (String Descriptor)
Language 0x0409          : "5D94176E3039"
Data (HexDump)           : 1A 03 35 00 44 00 39 00 34 00 31 00 37 00 36 00   ..5.D.9.4.1.7.6.
                           45 00 33 00 30 00 33 00 39 00                     E.3.0.3.9.

